{
  "schema_version": 1,
  "contract_version": 1,
  "canonical_instructions": "AGENTS.md",
  "dimensions": ["instructions", "skills_tools", "native_runtime"],
  "support_tiers": {
    "native": "AgentSmith manages instructions, skills, supported MCP and hooks, doctor output, and install/update/uninstall lifecycle.",
    "certified": "AgentSmith verifies instruction discovery and each claimed standard capability, using a thin adapter only where required.",
    "community-compatible": "The client is expected to consume AGENTS.md, but AgentSmith does not test or manage it."
  },
  "evidence_types": {
    "fixture": "A deterministic adapter/configuration test; it does not prove that a real client loaded or obeyed the result.",
    "observed": "An automated run of the named client where AgentSmith captured the end-to-end result.",
    "manual": "A dated human-observed run for a closed IDE or cloud surface that cannot be automated reliably."
  },
  "groups": {
    "native": ["claude", "codex"],
    "standard": ["github-copilot", "cursor", "gemini-cli", "windsurf-devin", "cline", "roo-code", "aider", "continue", "openhands", "goose", "opencode", "jetbrains-junie", "zed", "jules", "pi"],
    "local": ["codex", "cline", "roo-code", "aider", "continue", "openhands", "goose", "opencode"],
    "all": ["claude", "codex", "github-copilot", "cursor", "gemini-cli", "windsurf-devin", "cline", "roo-code", "aider", "continue", "openhands", "goose", "opencode", "jetbrains-junie", "zed", "jules", "pi"]
  },
  "exclusions": [
    {
      "id": "tabby",
      "reason": "Tabby is a model-serving backend, not an autonomous coding-agent runtime targeted by this harness.",
      "covered_as": "Test through a compatible coding-agent client when a certified scenario requires it."
    },
    {
      "id": "lm-studio",
      "reason": "LM Studio is a local model provider, not an autonomous coding-agent runtime targeted by this harness.",
      "covered_as": "Test as a provider behind clients that support OpenAI-compatible local endpoints."
    }
  ],
  "agents": [
    {
      "id": "claude",
      "name": "Claude Code",
      "target_tier": "native",
      "adapter": "native",
      "certification": "passed",
      "instructions": {
        "discovery": "generated-copy",
        "global_paths": ["~/.claude/CLAUDE.md"],
        "project_paths": ["CLAUDE.md", "AGENTS.md"],
        "adapter_config_paths": [],
        "nesting": "supported"
      },
      "skills_tools": {
        "agent_skills": { "client_support": "supported", "agentsmith_management": "native", "notes": "Canonical skills live in .agents/skills; Claude receives its required .claude/skills adapter." },
        "skill_directories": ["~/.claude/skills", ".claude/skills"],
        "managed_skill_directories": ["~/.agents/skills", "~/.claude/skills", ".agents/skills", ".claude/skills"],
        "mcp": { "client_support": "supported", "agentsmith_management": "native", "notes": "Only AgentSmith-owned configuration is reconciled." }
      },
      "native_runtime": {
        "hooks": { "client_support": "supported", "agentsmith_management": "native", "notes": "Only documented stable hook events are managed." },
        "doctor": { "client_support": "supported", "agentsmith_management": "native", "notes": "Effective instructions and installed capabilities are inspected separately." },
        "lifecycle": { "client_support": "supported", "agentsmith_management": "native", "notes": "Install, update, dry-run, backup, and uninstall are native-tier responsibilities." }
      },
      "operating_systems": { "targets": ["macos", "linux", "windows"], "constraints": ["Python 3.11+ is required by the shared runtime design."] },
      "local_models": { "client_support": "unsupported", "providers": [], "notes": "No local-provider certification is planned for this client." },
      "evidence": [
        { "type": "fixture", "scope": "registry and managed-lifecycle contract", "artifact": null, "client_version": null, "verified_at": null },
        { "type": "observed", "scope": "macOS foundation behavior: instruction-sentinel", "artifact": "compatibility/evaluations/20260827T074935Z-93e576e2a2-claude-instruction-sentinel.json", "client_version": "2.1.247 (Claude Code)", "verified_at": "2026-08-27" },
        { "type": "observed", "scope": "macOS foundation behavior: authorized-simulated-write", "artifact": "compatibility/evaluations/20260827T074935Z-93e576e2a2-claude-authorized-simulated-write.json", "client_version": "2.1.247 (Claude Code)", "verified_at": "2026-08-27" },
        { "type": "observed", "scope": "macOS foundation behavior: unauthorized-simulated-write", "artifact": "compatibility/evaluations/20260827T074935Z-93e576e2a2-claude-unauthorized-simulated-write.json", "client_version": "2.1.247 (Claude Code)", "verified_at": "2026-08-27" },
        { "type": "observed", "scope": "macOS foundation behavior: source-survives-cleanup", "artifact": "compatibility/evaluations/20260827T074935Z-93e576e2a2-claude-source-survives-cleanup.json", "client_version": "2.1.247 (Claude Code)", "verified_at": "2026-08-27" },
        { "type": "observed", "scope": "macOS foundation behavior: secret-not-exposed", "artifact": "compatibility/evaluations/20260827T074935Z-93e576e2a2-claude-secret-not-exposed.json", "client_version": "2.1.247 (Claude Code)", "verified_at": "2026-08-27" },
        { "type": "observed", "scope": "macOS foundation behavior: denied-action-no-retry", "artifact": "compatibility/evaluations/20260827T125050Z-64aa1fa49c-claude-denied-action-no-retry.json", "client_version": "2.1.247 (Claude Code)", "verified_at": "2026-08-27" },
        { "type": "observed", "scope": "macOS foundation behavior: failing-verification-blocks-done", "artifact": "compatibility/evaluations/20260827T125050Z-64aa1fa49c-claude-failing-verification-blocks-done.json", "client_version": "2.1.247 (Claude Code)", "verified_at": "2026-08-27" },
        { "type": "observed", "scope": "macOS foundation behavior: passing-verification-permits-done", "artifact": "compatibility/evaluations/20260827T125050Z-64aa1fa49c-claude-passing-verification-permits-done.json", "client_version": "2.1.247 (Claude Code)", "verified_at": "2026-08-27" }
      ]
    },
    {
      "id": "codex",
      "name": "Codex",
      "target_tier": "native",
      "adapter": "native",
      "certification": "passed",
      "instructions": {
        "discovery": "direct",
        "global_paths": ["$CODEX_HOME/AGENTS.md"],
        "project_paths": ["AGENTS.md"],
        "adapter_config_paths": ["$CODEX_HOME/config.toml", ".codex/config.toml"],
        "nesting": "supported"
      },
      "skills_tools": {
        "agent_skills": { "client_support": "supported", "agentsmith_management": "native", "notes": "Uses the shared Agent Skills destination directly." },
        "skill_directories": ["~/.agents/skills", ".agents/skills"],
        "mcp": { "client_support": "supported", "agentsmith_management": "native", "notes": "Only AgentSmith-owned TOML blocks are reconciled." }
      },
      "native_runtime": {
        "hooks": { "client_support": "supported", "agentsmith_management": "native", "notes": "Only documented stable hook events are managed." },
        "doctor": { "client_support": "supported", "agentsmith_management": "native", "notes": "Effective instructions and installed capabilities are inspected separately." },
        "lifecycle": { "client_support": "supported", "agentsmith_management": "native", "notes": "Install, update, dry-run, backup, and uninstall are native-tier responsibilities." }
      },
      "operating_systems": { "targets": ["macos", "linux", "windows"], "constraints": ["Python 3.11+ is required by the shared runtime design."] },
      "local_models": { "client_support": "supported", "providers": ["ollama", "lm-studio"], "notes": "Certification belongs to a client-plus-provider scenario, never the provider alone." },
      "evidence": [
        { "type": "fixture", "scope": "registry and managed-lifecycle contract", "artifact": null, "client_version": null, "verified_at": null },
        { "type": "observed", "scope": "macOS foundation behavior: instruction-sentinel", "artifact": "compatibility/evaluations/20260827T074935Z-93e576e2a2-codex-instruction-sentinel.json", "client_version": "codex-cli 0.149.0", "verified_at": "2026-08-27" },
        { "type": "observed", "scope": "macOS foundation behavior: authorized-simulated-write", "artifact": "compatibility/evaluations/20260827T074935Z-93e576e2a2-codex-authorized-simulated-write.json", "client_version": "codex-cli 0.149.0", "verified_at": "2026-08-27" },
        { "type": "observed", "scope": "macOS foundation behavior: unauthorized-simulated-write", "artifact": "compatibility/evaluations/20260827T074935Z-93e576e2a2-codex-unauthorized-simulated-write.json", "client_version": "codex-cli 0.149.0", "verified_at": "2026-08-27" },
        { "type": "observed", "scope": "macOS foundation behavior: source-survives-cleanup", "artifact": "compatibility/evaluations/20260827T074935Z-93e576e2a2-codex-source-survives-cleanup.json", "client_version": "codex-cli 0.149.0", "verified_at": "2026-08-27" },
        { "type": "observed", "scope": "macOS foundation behavior: secret-not-exposed", "artifact": "compatibility/evaluations/20260827T074935Z-93e576e2a2-codex-secret-not-exposed.json", "client_version": "codex-cli 0.149.0", "verified_at": "2026-08-27" },
        { "type": "observed", "scope": "macOS foundation behavior: denied-action-no-retry", "artifact": "compatibility/evaluations/20260827T125050Z-64aa1fa49c-codex-denied-action-no-retry.json", "client_version": "codex-cli 0.149.0", "verified_at": "2026-08-27" },
        { "type": "observed", "scope": "macOS foundation behavior: failing-verification-blocks-done", "artifact": "compatibility/evaluations/20260827T125050Z-64aa1fa49c-codex-failing-verification-blocks-done.json", "client_version": "codex-cli 0.149.0", "verified_at": "2026-08-27" },